Index	true_label	text	shap	pred_label
723	1	From wildfires in Australia and California to hurricanes and flooding in Florida, a variety of extreme events will become more severe and more common as climate change accelerates.	[('From', 0.03554448924834383), ('in', 0.007031284510100913), ('more', 0.0007154846208108479), ('more', -0.001559648478525022), ('wildfires', -0.004335933401684615)]	1
724	1	The decision upends a determination by Republican Secretary of State Tre Hargett’s office that fear of catching or unwittingly spreading the virus at the polls wouldn’t qualify someone to vote by mail, The state argued such an expansion wouldn’t be feasible for the 2020 elections, claiming lack of money, personnel and equipment for increased voting by mail, among other concerns.	[('equipment', 0.01780114724195785), ('lack', 0.009032700515836736), ('argued', 0.006228275076249081), ('decision', 0.002264900247391449), ('virus', 0.0013139389927161126), ('spreading', 0.0006677092430545572), ('the', 4.6014292757006195e-05), ('Secretary', -0.0018626562771465194), ('qualify', -0.0061776605532077155), ('State', -0.012052609627948973)]	1
725	1	Ingraham began the exchange by noting American graduates’ salaries have been suppressed by the flood of foreign graduates.	[('of', 0.019812654871738014), ('the', 0.003528569448886041), ('by', 0.000196298983225065)]	1
726	0	Professional camaraderie between fighters of different races in the sport of boxing is evidence of America moving beyond racial divisions, assessed Randy Gordon, host of SiriusXM’s At the Fights.	[('between', 0.03161149313105076), ('of', 0.005177286627927154), ('the', 0.0009604499274310685), ('evidence', -0.0001523247177658904), ('races', -0.009716543975465548)]	1
727	0	The plan would particularly benefit black, Latino and lower-income households, as well as households headed by people who never finished college, the researchers said.	[('well', 0.02664936128497691), ('households,', 0.0022089664944592103), ('headed', 0.0004890600924499244), ('particularly', -0.002100673997277431)]	1
728	1	Should China be the first country to develop an effective vaccine, dictator Xi Jinping has promised to provide the world with “free” coronavirus vaccines paid for by Beijing. 	[('be', 0.031076495569234447), ('Jinping', 0.002052225332705645), ('Xi', 0.00077613975087645), ('the', -0.00033292549361643053), ('to', -0.009057902690897228)]	1
729	1	The right to abortion is just that — the right to kill unborn humans. But pro-abortionists like Quinn and Cuomo find it easier to argue that they are fighting for “reproductive rights” (even though pro-lifers are not objecting to any woman’s right to reproduce) or that fetuses are not humans but “clumps of cells.” Just as with slave owners and eugenicists before them, it’s easier for pro-abortionists to advocate for murder after they’ve dehumanized the lives they want to end.	[('after', 0.019781685606641803), ('woman’s', 0.010346105366054442), ('want', 0.006326329131386282), ('to', 0.0051129817786791125), ('rights”', 0.004422733632460081), ('to', 0.0031853193693245673), ('end.', 0.002368782661155545), ('murder', 0.0006859127144722898), ('dehumanized', 0.0), ('the', -0.0007676584421867439), ('reproduce)', -0.0012912691342218707), ('fetuses', -0.0033552488987416006), ('just', -0.0069867426409917525), ('though', -0.012612183969633022)]	1
730	0	Federal judges on Monday blocked officials in Texas, Ohio and Alabama from curbing most abortions in those states as part of their orders to postpone surgeries and other procedures deemed not medically necessary during the coronavirus crisis.	[('officials', 0.027078754860958214), ('to', 0.009792887644759716), ('Alabama', 0.002657545889169065), ('necessary', -0.0005029678538081872), ('as', -0.0014310431380221366), ('during', -0.0019127252921370375), ('of', -0.01434818887072018)]	1
731	1	Breaking store windows, setting buildings on fire, vandalizing monuments to American heroes, leaving graffiti threats on synagogue walls, attacking Christian churches and tombstones, terrorizing the living, and giving no peace to the dead— these are the great accomplishments of Antifa and those they egg on.	[('leaving', 0.023189523111408105), ('accomplishments', 0.003788743287630091), ('monuments', 0.002695712077465515), ('threats', 0.0006657906440425088), ('these', -0.0012404343682737263), ('and', -0.005081025920201841), ('on', -0.005995883683208886), ('buildings', -0.011887063617324223)]	1
732	0	Steven Hatfill, MD, a virologist with master’s degrees in microbial genetics, radiation biochemistry, and experimental pathology, does not put his faith in large bureaucratic organizations such as the World Health Organization (WHO).	[('large', 0.026605321510770885), ('as', 0.0033039922855250038), ('Organization', 0.0003560049204389137), ('biochemistry,', 0.0), ('(WHO).', -0.0003865163277056827), ('and', -0.01471116431893758)]	1
733	0	A report in The New York Times claims that the UFC star Conor McGregor sexually assaulted a woman in Ireland.	[('Ireland.', 0.026008352525820278), ('The', 0.004124100724532732), ('sexually', -0.0007681436863777657), ('McGregor', -0.0046848194422756525)]	1
734	1	Conway recycled a right-wing talking point that falsely claims a bill designed to loosen certain restrictions on late-term abortions in Virginia is “infanticide” during her Monday appearance on “Outnumbered Overtime with Harris Faulkner.”	[('Monday', 0.013878081183531218), ('abortions', 0.005630843500701877), ('designed', 0.00015720194375211328), ('recycled', -0.0003191187585564381), ('talking', -0.004679403664860077), ('to', -0.011542740293249996)]	1
735	0	Hungarian Prime Minister Viktor Orbán also denounced the policy of Chancellor Angela Merkel and the attitude of the German media, which “are constantly pushing” for Europe to welcome more and more migrants, in opposition to the will of the Hungarian people.	[('Prime', 0.01784759044130029), ('Minister', 0.0044538049083622435), ('Viktor', 0.0028545929629786317), ('constantly', 0.001935727993253571), ('Angela', 0.0007711237487104405), ('and', -0.004969119166436545), ('in', -0.008289764633781173)]	1
736	1	Anti-vaccine groups take dangerous online harassment into the real world	[('into', 0.007085466410432822), ('online', -0.004681079505697771)]	1
737	0	"Michelle Williams won a Golden Globe for her role in ""Fosse/Verdon"" on Sunday night, but perhaps her biggest moment came during her acceptance speech when she defended abortion rights and encouraged women to vote ""in your own self-interest."""	[('Michelle', 0.01662738045013875), ('came', 0.0069273844700402385), ('her', 0.0025382851431967725), ('a', 0.0), ('perhaps', -0.001644929293636238), ('to', -0.006031267368440752), ('for', -0.025174700130873192)]	1
738	1	Democrats have made it clear they will sandbag the people we’ve elected to govern if we refuse to vote for Democrats. 	[('to', 0.01821103364150449), ('elected', 0.006814784660522107), ('clear', 0.0008030993900727767), ('govern', -0.0016516363582397752)]	1
739	0	An initiative to build bridges between the Greek and Turkish speaking communities of ethnically split Cyprus faltered after the leader of the breakaway Turkish Cypriots skipped a soccer match over a dispute of the game's location.	[('between', 0.03389245216730754), ('the', 0.002115840856723484), ('Turkish', 6.205908672357596e-06), ('faltered', -2.0567574658045817e-05), ('skipped', -0.0004455568700242463), ('dispute', -0.00803989116532894)]	1
740	0	The debt load for those who pursue law or medical school will undoubtedly be higher, and might be stacked on top of existing debt incurred by undergraduate degrees.	[('of', 0.012379592772834094), ('or', 0.0057344544139494805), ('those', 0.0010218871670777151), ('medical', -0.003675775913024634), ('and', -0.011400440433649099)]	1
741	0	Rep. Eric Swalwell (D-CA) interrupted debate moderators to discuss the struggles of student loan debt during the second night of the Democrat presidential debates held in Miami, Florida, Thursday night.	[('presidential', 0.018137386427769023), ('of', 0.006765512999920092), ('the', 0.0014056649140677569), ('discuss', 0.00022219476839423048), ('Democrat', -0.007999697514225806)]	1
742	1	China appears to be feeding off similar complaints from the left in the United States. Complaints about partisan “gridlock” are perennial and grow especially loud when Democrats and their highly sympathetic media are the ones complaining about Republicans getting in their way.	[('especially', 0.030307512476508324), ('and', 0.01031612230054078), ('in', 0.0010845500461176937), ('sympathetic', 9.40263135341346e-06), ('“gridlock”', -0.001439064855227583), ('loud', -0.003252831244336135), ('partisan', -0.006069606588272334)]	1
743	1	In Washington, three key issues seemed to galvanize most of the protesters: climate change, immigration and reproductive rights.	[('most', 0.02463121951689541), ('three', 0.008930252350700702), ('rights.', 0.0012071177991966487)]	1
744	0	Jay-Z and the NFL began teaming up as part of a social justice initiative announced last summer in the wake of the controversy over players kneeling during the national anthem to protest racial injustice.	[('summer', 0.014963220412744203), ('the', 0.003690193114488903), ('part', 0.0013017207979202795), ('social', 0.0003398094321903833), ('up', -0.001314687110742412), ('protest', -0.012750417004826948)]	1
745	0	All of which serves as an important reminder: the president isn’t just ignoring scientists and related policy experts; he’s also ignoring his own administration that issued a related report, noting that climate change is a global security threat.	[('just', 0.03525152055435858), ('as', 0.010647934848705638), ('that', 0.0023787883600936044), ('a', 0.0), ('issued', -0.0028194661729519445), ('policy', -0.004821832793885814), ('noting', -0.010465418777420701)]	1
746	1	Italy has deported several radical imams in recent years, including a Tunisian earlier this year who came into the country illegally and declared to police that he would not only kill them but he would eat their corpses as well.	[('police', 0.0206372983271054), ('in', 0.009433043621231634), ('would', 0.00538797006379295), ('year', 0.0007123277321633226), ('as', -0.00015126980042793782), ('recent', -0.004129823782620387), ('into', -0.007912292403520479)]	1
747	0	Google declined to offer details beyond Huntley’s tweets, but the unusually public attribution is a sign of how sensitive Americans have become to digital espionage efforts aimed at political campaigns.	[('of', 0.015007932114413081), ('the', 0.005701551089354124), ('Huntley’s', 0.0), ('aimed', -0.00027281863861158606), ('attribution', -0.003021791435783896)]	1
748	1	In practice, that means it's hard to trust Bezos' pledge when Amazon, the source of his wealth, has been aggressively courting oil and gas companies with its cloud computing services and threatened workers who campaigned for stronger climate action with dismissal. 	[('gas', 0.029825311326021477), ('his', 0.009157982729220136), ('dismissal.', 0.0020729092141526318), ('companies', 0.0003062388413354922), ('that', -0.00036517446828649103), ('hard', -0.005401690377488856), ('with', -0.010883176875174256)]	1
749	0	The trio ended up on the wet, slippery wall after smugglers abandoned them.	[('abandoned', 0.0066200915614910046), ('smugglers', 0.0017699092091639935), ('after', -0.028727768707254363)]	1
750	1	There can be no serious discussion of this issue, however, in 60-second sound bites. So, beyond the soak-the-rich shtick that shades every Democratic economic debate point, the candidates resorted to two tactics: shock and sob stories.	[('can', 0.018314003820685976), ('candidates', 0.010610993760529763), ('that', 0.006090341679716242), ('in', 0.0024363860360835476), ('however,', -0.0004835752478030519), ('of', -0.007628658883211522)]	1
751	1	Trump’s approval rating remains resilient at around 40%, with a large majority of Republicans still approving of his overall performance. But sustained pessimism among Trump’s supporters could portend potential weakness ahead of November’s election, when he will face Democratic former Vice President Joe Biden, experts said.	[('overall', 0.022549491629758184), ('of', 0.004850784198820519), ('40%,', 0.0018878917378917259), ('face', 0.00027099269492965707), ('around', -0.0005812628080171734), ('pessimism', -0.001011056961158996), ('election,', -0.006209683824947024), ('rating', -0.012641555512388823)]	1
752	0	A poll released Tuesday finds 75 percent of Americans want substantial restrictions on abortion, including 60 percent of Democrats and 61 percent of those who identify as “pro-choice.”	[('“pro-choice.”', 0.03292472371074249), ('on', 0.0031746781027129144), ('substantial', 0.0018774550047810068), ('Democrats', -0.0025607123870281657), ('those', -0.006411762340807839)]	1
753	1	Smith’s announcement Sunday at the all-male, historically black college in Atlanta, Georgia provoked impassioned calls for both making higher education free across the country and canceling student debt.	[('for', 0.030363857938077384), ('college', 0.005452157391328058), ('at', 0.0015390773155184478), ('Atlanta,', -0.0011086476908046972), ('free', -0.007457318483606745)]	1
754	1	Impeachment Is Just Another Word For Delusional Democrats Holding The Nation Hostage	[('For', 0.0021489536946526265), ('Is', 0.00017370892018779173)]	1
755	1	However, the 45-year-old actor Joaquin Phoenix used his time on stage to call for his celebrity cohorts to put their money where their mouths are when it comes to climate change.	[('used', 0.04920605225327339), ('money', 0.006956649771672296), ('their', 0.0005853541818083851), ('on', -0.00010236284102146497), ('Phoenix', -0.004264837266462436), ('for', -0.029155700583619014)]	1
756	1	Though  Alexandria Ocasio-Cortez was by no means the first to describe migrant detention centres as concentration camps — disgraced Arizona Sheriff Joe Arpaio boasted his “tent city” in the Sonora Desert was just that — her comments ignited a firestorm of controversy.	[('just', 0.022794903210926188), ('describe', 0.01144209514381203), ('centres', 0.0008545492521460064), ('—', 0.0), ('Desert', -0.0009153623690770185), ('Ocasio-Cortez', -0.0018597552375413118), ('boasted', -0.0038390129787731274), ('of', -0.021573498931238406)]	1
757	1	For starters, Gautney, per her Twitter profile, is an associate professor of sociology at Fordham University, a private school located in New York City. None of this is a problem on its own; in a free society, people should be able to tweet whatever dumb things they want while working in whichever industry or field of research.	[('this', 0.024678639302388703), ('own;', 0.010076540315988454), ('things', 0.006121395588065474), ('York', 0.0028998927227720517), ('located', 0.0001264678745622405), ('Fordham', -0.0001811552567604402), ('in', -0.0008807241305791747), ('in', -0.0027006886040444444), ('able', -0.00443688988754802), ('working', -0.018144978392782174)]	1
758	1	For several years, climate change doomsayers have turned their attention to cattle, as a series of reports demonstrated that “livestock emissions” are more dangerous for the environment than automobiles.	[('of', 0.014591188709936647), ('automobiles.', 0.005759588976672028), ('emissions”', 0.0025326802395692315), ('a', 0.0), ('are', -0.013112534941775637)]	1
759	0	The votes come as a new conservative majority on the nation’s highest court has made abortion rights supporters nervous. 	[('made', 0.031812724911587244), ('the', 0.005958924071379921), ('', 0.0), ('has', -0.013530170424399355)]	1
760	0	Although duties set to kick in soon will affect all manner of sports equipment that hasn’t been made in America for decades, baseball enthusiasts are perhaps affected most because so many items are needed to play the game.	[('for', 0.02746786186258978), ('that', 0.013412717284295822), ('to', 0.005511015314950228), ('the', -0.0004752569432486342), ('baseball', -0.0022406127111525066), ('game.', -0.004941950781998049), ('decades,', -0.026822528967223716)]	1
761	0	Some moderate Democrats have criticized that proposal, arguing that it would burden the wealthy and middle-class to help the working class, or that it would raise the national debt, which is currently $23 trillion.	[('raise', 0.02326054133169721), ('proposal,', 0.009697980842550443), ('would', 0.003544704622124548), ('that', -0.0001682883130951407), ('moderate', -0.0017745257266145941), ('middle-class', -0.006826268044373002)]	1
762	1	Unbelievably, with all they had seen their child suffer, his parents not only refused the doctor’s suggestion that he receive another DTaP vaccination they also declined all the other scheduled vaccinations the boy had missed.	[('his', 0.01629041530379619), ('the', 0.002342901008311933), ('all', 0.00023728813559320883), ('child', -0.0008724734815189716), ('refused', -0.0019010449100904025), ('had', -0.004820525395452516)]	1
763	1	Yet it far better applies to unelected career bureaucrats’ use of their power to prosecute their political enemies, which comprises the heart of the “resistance” to Republican rule that will endure so long as bureaucracy has enough power to challenged elected branches of government. This bureacracy weaponization was also a hallmark of the Obama presidency, with — ironies of ironies — perhaps the biggest evidences again coming from the Department of Justice under attorneys general Eric Holder and Loretta Lynch.	[('use', 0.014984567433930411), ('long', 0.008979396790162625), ('so', 0.006232438794726935), ('coming', 0.0024831200751825335), ('of', 0.0005270224476314878), ('the', 0.00022266032360372502), ('endure', 9.62389546898812e-05), ('the', -4.2210114463169246e-05), ('unelected', -0.0003521167194310304), ('that', -0.0007949849342566528), ('to', -0.0014175537514894453), ('to', -0.0027674899967909095), ('from', -0.007139329978358734), ('will', -0.015959602521439645)]	1
764	1	A woman who was the victim of a brutal gang rape attack in 2007 has spoken out about her ordeal and her attacker not being deported thanks to passengers aboard his flight.	[('about', 0.026197104294111505), ('of', 0.007874148922379427), ('her', 0.0031176971960436804), ('flight.', 0.0006697630901145501), ('gang', -0.0011609288455428678), ('and', -0.011606397192867131)]	1
765	1	The president’s likely opponent in the November elections, Democrat Joe Biden, was not among those who were inspired. Instead, tone-deaf as he is to the American people and the things of the Spirit, he said the president’s appearance outside the church shows he “is more interested in power than in principle.”	[('church', 0.020390711435494487), ('as', 0.005564523735620833), ('“is', 0.0022379367062306922), ('the', 0.0009522559510631123), ('the', -0.0002896492057746547), ('not', -0.0023209753858001825), ('he', -0.004292070474328547), ('than', -0.006816394142030979), ('opponent', -0.012754550311030509)]	1
766	0	The oil price crash has led to Danish offshore wind developer Orsted overtaking Norwegian oil major Equinor as the most valuable energy company in the Nordics, highlighting the appeal to investors of renewables over fossil fuels.	[('company', 0.01665499003299789), ('the', 0.0029595016932752773), ('the', 0.0014306966618287409), ('fossil', 8.551907177491325e-05), ('oil', -0.00024344456202056607), ('to', -0.007816651677743204)]	1
767	1	During her acceptance speech for best actress in a limited television series for Fosse/Vernon, Williams went on a bizarre rant about the need for abortion rights in the United States and for American women to vote for pro-choice candidates during election years.	[('pro-choice', 0.03090140548281422), ('series', 0.010577186252536506), ('women', 0.0023330457859822283), ('a', 0.0), ('for', -0.0016707255552126155), ('for', -0.0037731071386981974), ('in', -0.006932300476877342)]	1
768	1	The 2010s saw the U.S. economy achieve its longest-ever expansion, with notable milestones such as 110 months of uninterrupted job gains and an unemployment rate near a half-century low becoming easy bragging points for politicians and economists alike.	[('such', 0.024762384553464495), ('and', 0.0068652125219629745), ('an', 0.0037826221330999744), ('2010s', 0.0), ('economists', -0.0003834664957958589), ('uninterrupted', -0.0021256911650646116), ('of', -0.012661672530357533)]	1
769	0	Sexual abuse gymnasts have made it clear they will not accept a settlement offer from USA Gymnastics that releases the U.S. Olympic and Paralympic Committee (USOPC) without it making a significant financial contribution.	[('without', 0.022475312530835633), ('it', 0.006131788348311509), ('Gymnastics', 0.0), ('Olympic', -0.0006688782276474381), ('clear', -0.0051538032591403925), ('will', -0.013706281730017705)]	1
770	1	Student loan debt is no doubt a drag on the U.S. economy, holding back how much money young consumers can spend on cars, homes and even invest in 401(k) plans or new businesses. 	[('new', 0.034985143284114326), ('the', 0.004663292568194991), ('Student', 0.0006645044447720738), ('doubt', -2.5660370389841703e-05), ('on', -0.007907824027406203), ('much', -0.015622430014966483)]	1
771	1	Donald Trump announced at the time that the Environmental Protection Agency would be led, at least temporarily, by Andrew Wheeler – a former lobbyist for, among others, Murray Energy, one of the nation’s largest coal companies and former chief counsel for Sen. James Inhofe (R-Okla.), one of the nation’s preeminent climate deniers.	[('others,', 0.03397965754017825), ('Sen.', 0.009337232816977185), ('the', 0.0036034345266892486), ('the', 0.0020300335860042717), ('announced', 0.00042824865193287655), ('coal', -0.00048408793136326734), ('one', -0.001566179879023044), ('counsel', -0.005263009938654289), ('for,', -0.008563502875358368)]	1
772	0	Now 25, he sought asylum after fleeing gangs trying to recruit him in his native Honduras, a place where saying “no” can mean execution.	[('after', 0.028823127397528337), ('saying', 0.011321352241522318), ('in', 0.0002181803960289963), ('mean', -0.003960749460041955)]	1
773	0	The Senegalese was subjected to insults and monkey chants during the match against Inter Milan at San Siro on Boxing Day and was sent off for dissent late in the game with Napoli coach Carlo Ancelotti blaming his loss of temper on the atmosphere in the stadium.	[('sent', 0.027132969330950746), ('subjected', 0.0036248954967907743), ('atmosphere', 0.002794078492059763), ('match', 0.001114346661050103), ('the', 0.0007635069589650756), ('Ancelotti', 0.0), ('Day', -0.004748930083721325), ('in', -0.008239434088358987)]	1
774	1	It is a monumental ode to human stupidity that the wealthiest nation in the world teeters on the edge of a dangerous measles epidemic at the same time that poor nations are struggling to vaccinate their residents. 	[('It', 0.03587268512784069), ('epidemic', 0.004812749751485096), ('the', 0.0016418195851732654), ('measles', 0.0008575309556858391), ('ode', 0.0), ('on', -0.004540889725078088), ('to', -0.012869163389994156)]	1
775	1	Protecting pregnant women, new mothers and children is about more than scoring political points with anti-choice legislation.	[('new', 0.036590019086938395), ('political', -0.001332474747474699), ('than', -0.0039110695921561)]	1
776	1	The failure to act to ameliorate global warming exposes the myth of human progress and the illusion that we are rational creatures. 	[('of', 0.022720822470470643), ('warming', 0.003956235500192443), ('global', -0.0017911765946712554), ('we', -0.011267807439976027)]	1
777	0	Meanwhile, uneven enforcement across the platform means a person or page may be disciplined or banned while a related group continues to operate.	[('be', 0.016876580612570344), ('means', 0.003154234183895199), ('uneven', 0.0008939012670467161), ('enforcement', -0.010898019019928862)]	1
778	0	Nearly two-thirds of voters think President Donald Trump will be reelected in November, a CBS News poll released Sunday found. 	[('two-thirds', 0.014655649661609933), ('Nearly', 0.0018872814332498433), ('Sunday', -0.0004741830065359509), ('News', -0.008738387830125772)]	1
779	1	Helen Maroulis was one of the most celebrated Olympians in 2016 when she became the first American woman to win a gold medal in wrestling.	[('most', 0.032549105835634806), ('first', 0.01033762719455188), ('Maroulis', 0.0), ('the', -0.001971345828845812), ('she', -0.014824600948288165)]	1
780	0	A recent study found that college students from high-income households are borrowing more money for school than students from households with lower incomes. The report added that students from wealthier families are responsible for some of the more drastic borrowing increases in recent years.	[('years.', 0.017198343079922022), ('are', 0.008801463705013099), ('from', 0.00400724174076484), ('recent', 0.002198879551820717), ('A', 0.0), ('that', -0.0011843596292990055), ('found', -0.0028960232826073496), ('in', -0.0067033784228921044)]	1
781	0	A divided federal appeals court on Tuesday rejected Planned Parenthood’s constitutional challenge to an Ohio law depriving the organization of state funding because it performs abortions, handing a victory to anti-abortion advocates.	[('advocates.', 0.034612427652108646), ('victory', 0.010128467046642704), ('depriving', 0.0025004299737333667), ('abortions,', 0.0008055485277690022), ('law', -0.0019384418338652997), ('organization', -0.01253188078968675)]	1
782	1	A protester could be seen throwing an object at Frey as he slinked away. Biden, so far, has enjoyed the luxury of remaining in his basement, hidden away from volatile activists who want answers.	[('be', 0.017960762460377252), ('the', 0.005669107661694806), ('enjoyed', 0.0013496113058809568), ('he', 0.0001280035376809785), ('hidden', -0.0005918696845265003), ('an', -0.005335958584335447)]	1
