Index	true_label	text	shap	pred_label
0	1	YouTube is making clear there will be no “birtherism” on its platform during this year’s U.S. presidential election – a belated response to a type of conspiracy theory more prevalent in the 2012 race.	[('presidential', 0.03742920566218258), ('“birtherism”', 0.005929185025845008), ('during', 0.0020588633009751456), ('U.S.', 0.0), ('year’s', -0.0034578459548795294), ('its', -0.013297714518691817)]	1
1	0	The increasingly bitter dispute between American women’s national soccer team and the U.S. Soccer Federation spilled onto the field Wednesday night when players wore their warm-up jerseys inside outin a protest before their 3-1 victory over Japan.	[('between', 0.023355282209943196), ('dispute', 0.003890574916714793), ('bitter', 2.9114459731265365e-05), ('a', 0.0), ('their', -0.0007885927391495662), ('field', -0.0055105985885466665), ('night', -0.029083340739073132)]	1
2	1	So while there may be a humanitarian crisis driving more vulnerable people to seek asylum in the United States, there is no security crisis.	[('security', 0.022834458568552273), ('crisis', 0.0070220320106065106), ('while', 0.0004211867177329298), ('there', -0.002999544492811378)]	1
3	0	A professor who teaches climate change classes — a subject some would question as a legitimate area of study — said she has seen students who suffer fear, grief, stress, and anxiety about the future.	[('about', 0.02511334838166128), ('the', 0.0016928253507498868), ('grief,', 0.00046945970984132003), ('—', 0.0), ('would', -0.003700526633714675), ('suffer', -0.00843803357709591)]	1
4	1	Looking around the United States, there is never enough welfare for the left to stop killing developing humans in utero—solidly Democratic states lead the nation in abortion rates. 	[('lead', 0.023178108084906786), ('stop', 0.006888662131519273), ('nation', 0.0006655924093747468), ('left', -0.00030841420743381255), ('there', -0.0074187025924170895)]	1
5	0	The World Anti-Doping Agency on Tuesday said that Russian authorities had failed to provide access to laboratory doping data by their year-end deadline and it will consider sanctions against the Russian Anti-Doping Agency (RUSADA).	[('year-end', 0.024384550629203316), ('and', 0.009046316107210352), ('The', 0.006072641324280189), ('on', 4.1338786837706863e-05), ('Tuesday', -0.0012055589246813868), ('Agency', -0.008212738699887801)]	1
6	1	The Republican president assumed he was helping the industry at the expense of the environment – a trade-off Trump was happy to make since he rejects climate science anyway. 	[('expense', 0.014732447799537704), ('happy', 0.004905957161099056), ('anyway.', 0.0016070034718422633), ('he', -0.00297146980328436), ('since', -0.008540299813181117)]	1
7	1	The explosion of the Hispanic population has long-term job prospect consequences as well: Both legal and illegal aliens will occupy 75 percent of new American jobs in as little as five years.	[('American', 0.02299034308730243), ('will', 0.012346651720422144), ('as', 0.003442192694028382), ('population', -0.001801011105296817), ('occupy', -0.003671438279533513), ('well:', -0.02375827319866612)]	1
8	1	The anti-vaccine movement made headlines last spring, when widespread distrust of the pharmaceutical industry and the belief that vaccines can lead to autism in children led to a measles outbreak. 	[('belief', 0.024051035784932225), ('and', 0.008051905293226155), ('distrust', 0.000541841291513867), ('measles', -0.0004607510011566973), ('autism', -0.0029455258554044682), ('made', -0.03502319027028358)]	1
9	0	Thousands of fetal remains that were found at an abortion doctor's suburban Chicago garage last year were buried Wednesday at an Indiana cemetery. 	[('of', 0.0134275330570923), ('at', 0.001186052281979605), ('', 0.0), ('an', -0.003315106924483385)]	1
10	0	Defending Democracy Together, a group of “Never Trump” conservatives including commentator Bill Kristol, created Republican Voters Against Trump. It is among several groups on the right ― including the Lincoln Project, which was co-founded by attorney George Conway and GOP strategists Rick Wilson and Steve Schmidt ― targeting the president as the election approaches.	[('on', 0.018751256463327516), ('co-founded', 0.006477582799674331), ('the', 0.0028612258515535406), ('election', 0.0008979918577662649), ('attorney', 3.8217158208313505e-05), ('Rick', -0.00030408844585599226), ('Project,', -0.0009587321675776105), ('GOP', -0.004816371673424403), ('Steve', -0.012541588546444393)]	1
11	1	Voting in quasi-militarized settings was not confined to the nation’s capital. In Philadelphia, on election eve, the mayor announced a curfew that was slated to take effect an hour before its polls closed, but subsequently delayed it after an outcry by other city officials and activists. 	[('officials', 0.02043274936918338), ('announced', 0.00801809169388117), ('mayor', 0.005481188154256026), ('not', 0.0020100495640926787), ('before', 0.001034205779787254), ('an', 5.186584333916167e-05), ('take', -0.001592617543467707), ('election', -0.006954938271604899)]	1
12	1	But one glaring absentee was Trump, who not only declined an invitation but failed to send any American representative at all.	[('American', 0.01677381176614928), ('one', 0.008378032239261026), ('all.', 0.0011959510357815617), ('only', -0.006998538011695884)]	1
13	0	Planned Parenthood, the abortion industry giant says the “white supremacy” and “systemic bias in policing” that “took George Floyd’s life” are the same factors involved in “attacks” on women’s abortion rights.	[('industry', 0.011939219535742545), ('women’s', 0.007663406094168541), ('the', 0.002343768407472482), ('Parenthood,', 0.001507054910322385), ('that', -0.0048807121842273935), ('and', -0.014254878224574346)]	1
14	1	Track and field athletes don’t typically earn the lucrative salaries seen in the NBA, NFL, tennis or international soccer.	[('salaries', 0.014917366522964154), ('tennis', 0.0007332608302178845), ('typically', -0.0011313932863146626), ('and', -0.01872428275055629)]	1
15	0	Cuba’s health ministry initially vowed an investigation into Paloma Dominguez Caballero’s death; last week, state media published a report essentially absolving the government of any wrongdoing, categorically stating that nothing was wrong with the vaccine Dominguez received.	[('of', 0.016441312151677507), ('Dominguez', 0.005013164185400397), ('ministry', 0.0019712177264961193), ('Paloma', 0.0), ('initially', -0.001930398772378995), ('that', -0.007142290941569692), ('any', -0.01729191320428284)]	1
16	1	In other words, the agency responsible for protecting consumers now wants to make it easier for them to get stuck in a cycle of debt they can never repay.	[('consumers', 0.015089017254977785), ('never', 0.009640000200542757), ('easier', 0.0011655121671655345), ('in', -0.0052682713743837295), ('for', -0.009415461382202846)]	1
17	0	Even as U.S. immigration officials have pushed to deport hundreds of Iraqi Christians over the last few years, asserting in court that they are unlikely to be targeted in their homeland, another arm of the Trump administration has insisted just the opposite, saying that Christians in Iraq face terror and extortion.	[('just', 0.02313697339014353), ('Iraqi', 0.008503544884779607), ('unlikely', 0.006855649421763672), ('Iraq', 0.0032187847770805324), ('pushed', -0.00034308297840851987), ('be', -0.001588502069240212), ('the', -0.0032868789238665696), ('over', -0.007245928235535275), ('have', -0.01116110041159692)]	1
18	0	Although he didn’t seem to direct his comments at anyone in particular, many celebrities that consider themselves climate change activists have not adjusted their lifestyles of taking private jets to their engagements around the globe, for example, Leonardo DiCaprio, Katy Perry and Orlando Bloom all took heat in 2019 when they were among the A-listers to attend Google’s climate change conference by way of private jets and mega yachts.	[('his', 0.01651204281891167), ('Perry', 0.006790502274247146), ('when', 0.003259522851073605), ('the', 0.0023101596516690893), ('climate', 0.0018774614469290129), ('Leonardo', 0.0013869207131705496), ('example,', 0.0011637385183742143), ('their', 0.0007454043948391975), ('many', 0.00010574387947271612), ('mega', -0.0017266931484063918), ('they', -0.0036553919997979857), ('anyone', -0.014074564411083155)]	1
19	1	A Catholic priest in Rhode Island who barred state lawmakers who supported an abortion rights bill from receiving communion at his church has doubled down on his stance, saying abortion is worse than pedophilia.	[('church', 0.01622685500799733), ('his', 0.004432540690881465), ('barred', 0.0016556258336020346), ('communion', 0.0005802467572195935), ('Island', -0.0021690114197075094), ('has', -0.007199484237346458)]	1
20	1	Gwyneth Paltrow’s anti-vaxxer ally comes under fire for ‘discredited pseudo-scientific claims’ about coronavirus	[('for', 0.037076363869057896), ('Gwyneth', 0.00017857142857143348), ('about', -0.02301858380916562)]	1
21	0	The taxpayer-funded BBC has announced that 16-year-old eco-warrior Greta Thunberg will be guest-editing the broadcaster’s flagship current affairs radio programme, the Today show.	[('BBC', 0.016364162053423982), ('eco-warrior', 0.0029807302027910643), ('guest-editing', 0.001058461220403666), ('that', -0.008952338116427509)]	1
22	0	The German Federal State of Baden-Wuerttemberg is seeking damages from Volkswagen after local authorities purchased VW diesel vehicles which now face bans in cities like Stuttgart, Frankfurter Allgemeine Zeitung said on Saturday.	[('after', 0.0306804731915486), ('from', 0.007724062025590966), ('is', 0.0014553872069916673), ('Frankfurter', -0.0004883966439389864), ('Zeitung', -0.002009807328888762), ('seeking', -0.011963366979908258)]	1
23	1	Gadsby's work is a testament to how eagerly the arbiters of our culture will devour and elevate work that convincingly purports to be progressive.	[('our', 0.020687010843815773), ('progressive.', 0.007379340221000203), ('a', 0.0), ('purports', -0.002266480276235574)]	1
24	1	That’s led some vaccine foes to join the protesters — whom Trump has encouraged on Twitter — in staging demonstrations in state capitals to “reopen America.”	[('That’s', 0.015711917979039525), ('join', 0.009411387374732712), ('state', 0.0052623776135104815), ('whom', -0.0007698090915562772), ('led', -0.006994811608584157)]	1
25	1	Mississippi’s Republican governor signed one of America’s strictest abortion bills on Thursday banning women from obtaining an abortion once a fetal heartbeat is detected, which can often occur before a woman even realizes she is pregnant.	[('signed', 0.030106726363423528), ('on', 0.00684360014051064), ('pregnant.', 0.002634673713389092), ('Mississippi’s', 0.00040366666002367933), ('is', -0.0029178024134178405), ('America’s', -0.0075308838337532534)]	1
26	1	That’s why white nationalists, who are enthusiasts for the abortion of black and brown people, despise pro-lifers, as anyone reporting in good faith should know.	[('pro-lifers,', 0.023183012217365677), ('in', 0.004498176456300501), ('black', 0.0009269196249367562), ('anyone', -0.009007659903332313), ('for', -0.01942867518743523)]	1
27	1	President Donald Trump ridiculed former Secretary of State Colin Powell on Sunday for endorsing former Vice President Joe Biden for president.	[('State', 0.018386433027444537), ('President', 0.0074080393256725705), ('Biden', 0.00022029274827620516), ('on', -0.0035417853190322125)]	1
28	1	Biden was particularly critical of Trump’s visit on Monday to a historic church across from the White House, which was preceded by law enforcement authorities dispersing a crowd near the church with smoke canisters and flash grenades.	[('enforcement', 0.023654584552047494), ('preceded', 0.011768496913223155), ('near', 0.0013092552156642834), ('a', 0.0), ('visit', -0.0012922324945027486), ('law', -0.004286643824557342), ('which', -0.019783049424833877)]	1
29	0	The other witnesses at the hearing shared story after story about how Americans are struggling to pay off student loans, with many having to delay getting married, buying a home, and having children.	[('after', 0.019758094893395913), ('to', 0.009727286833700945), ('having', 0.0019127532662777957), ('struggling', -0.00018497084316083213), ('story', -0.004516908204803102), ('student', -0.0082017650264703)]	1
30	0	French sporting goods retailer Decathlon has confirmed they will not be stocking a sports hijab after public backlash and threats of a mass boycott.	[('after', 0.03595636950122632), ('they', 0.007145175213955606), ('sporting', 0.0007115541239521428), ('a', 0.0)]	1
31	1	Young women taking part in high school and college athletics across the country have had their dreams of winning dashed by the movement to allow biological male who “identify” as female to compete against them.	[('country', 0.01707263759467149), ('male', 0.006193277968667333), ('Young', 0.0014437758873477858), ('biological', 0.0004125247344374072), ('their', -0.005844387018044462), ('school', -0.011710843212760337)]	1
32	0	Australian sports stars, sparked in part by a call to action from tennis player Nick Kyrgios, have rallied to raise funds in support of relief and recovery efforts for victims of the country’s bushfire catastrophe.	[('for', 0.02591666797173491), ('from', 0.007554052330105773), ('action', 0.00042401769334834196), ('relief', -0.000517793587555655), ('player', -0.0023355454913348084), ('of', -0.006144074843256233)]	1
33	1	Under current immigration policies, it’s possible that immigration arrests could lead to poor mental health by increasing deportation fears among undocumented individuals and their families and neighbors, the study authors write.	[('could', 0.01676437906436252), ('policies,', 0.007167878375883048), ('study', 0.00013261297582225495), ('their', -0.0009910512396026983), ('that', -0.00456793626904875), ('to', -0.019563123374147763)]	1
34	1	Less-organized migrants, tighter immigration control by Guatemalan authorities and the presence of U.S. advisers have reduced the likelihood that the hundreds of migrants who departed Honduras will form anything like the cohesive procession the term “caravan” now conjures.	[('of', 0.007906632451827269), ('immigration', 0.004527068900604349), ('form', 0.00043692431108616756), ('departed', -0.00012937636122395846), ('Guatemalan', -0.0007834895944701337), ('authorities', -0.004353912729096159), ('will', -0.012490266436987736)]	1
35	0	U.S. Education Secretary Betsy DeVos is withdrawing protections put in place by former President Barack Obama for students who have mismanaged or are defaulting on their college loans.	[('students', 0.008020415595519977), ('mismanaged', 0.0035469709871966417), ('loans.', 0.0011947349912051308), ('by', -0.0013710949833476772), ('President', -0.008078752772878724)]	1
36	1	Trump enjoys and encourages state brutality against people of color, and black people in particular. It excites him and his most ardent followers. But his response isn’t just based on personal predilections. It’s also based on political considerations.	[('him', 0.013869850657459895), ('It’s', 0.010911084528050641), ('followers.', 0.0028378935369066604), ('particular.', 0.0002826093849682021), ('people', -0.003473501052467366), ('and', -0.0061350939912307645), ('encourages', -0.023119315933141857)]	1
37	0	For the first time the annual risk report, compiled by the World Economic Forum (WEF), found the top five concerns were all environmental, from extreme weather to biodiversity loss and events like oil spills and radioactive contamination.	[('first', 0.018406340147433867), ('Economic', 0.008983717405212916), ('annual', 0.0013926282850448024), ('extreme', 0.0005761890965280759), ('spills', -0.0008292189229595149), ('time', -0.0031190356769667106), ('found', -0.011223739547318376)]	1
38	1	Abortionists, who prey on desperate people, should no longer receive your hard-earned tax dollars.	[('should', 0.03403250465188879), ('dollars.', -2.308153308266947e-06), ('on', -0.010373982559132766)]	1
39	1	The Trump administration has continued to deny climate change findings and make scientific reports inaccessible to the public.	[('continued', 0.015453252767359245), ('administration', 0.0013691942565455006), ('has', -0.004136905615651037)]	1
40	0	As controversies about the “reopening” of America loom over our lives, nothing seems as intrinsically irrelevant — yet possibly as critically important — as how soon major spectator sports return.	[('As', 0.022324359853593732), ('possibly', 0.007232282224184911), ('sports', 0.001724690299218613), ('controversies', -0.0005813834859456968), ('the', -0.00266219158200291)]	1
41	1	In the months that followed, all independent polling has found the American mainstream not only blames Trump and his party for the shutdown, but also does not want to spend billions of taxpayer dollars on an ineffective and unnecessary border wall.	[('followed,', 0.01609914316100744), ('all', 0.007710340818275293), ('the', 0.002882378511940399), ('blames', 0.001321289849255769), ('dollars', -0.0004856131193445279), ('also', -0.004548251785523927), ('and', -0.007499321255337656)]	1
42	0	Members of the German Green Party have proposed that so-called “climate refugees” should be allowed to move to the country and receive a German passport upon their arrival.	[('allowed', 0.023733297790885118), ('have', 0.006035105774728391), ('the', 0.0011554837730982025), ('Green', -0.001285584848721928), ('upon', -0.008457961111236048)]	1
43	1	Kendrick, who, like many Planned Parenthood supporters, blames men for pro-life legislation while she ignores mention of the life of unborn babies, also drafted a “testicular bill of rights.	[('pro-life', 0.026027604900964563), ('of', 0.00695900498916009), ('the', 0.0032405867287670876), ('a', 0.0), ('while', -0.010279093545151486)]	1
44	1	"UFC Middleweight Champion Israel Adesanya’s comment that his opponent will ""crumble like the Twin Towers"", in addition to being terrible and inappropriate, also makes no sense. "	[('will', 0.02192354520573227), ('no', 0.007319542435815317), ('Champion', 0.0016216036166699166), ('Adesanya’s', 0.0), ('sense.', -0.009941161603821138)]	1
45	1	Yet when researchers in the U.S. have been so corrupt they have gone to jail, mainstream scientists still accept their research.	[('so', 0.025066529703817838), ('scientists', 0.0011908731124563178), ('have', -0.0002942633886030421), ('in', -0.011069950129820705)]	1
46	1	Donald Trump has taken heat for mostly refusing to mask up while performing his duties. This left the Biden camp with a choice to make when Joe woke up from political hibernation, and they went all in.	[('when', 0.022970244114062552), ('political', 0.005839592074592115), ('performing', 0.001232138433254939), ('choice', -0.0003667247962478537), ('taken', -0.0019988722134161785), ('to', -0.00479687341264765), ('This', -0.02679101831231648)]	1
47	1	Omar believes USA Powerlifting is discriminating against males who identify as transgender women, based on the “myth” that they have a “direct competitive advantage” over biological females.	[('USA', 0.009554698849236659), ('have', 0.005423448319674697), ('believes', 0.00023472270035213016), ('identify', -0.0007388769542904838), ('they', -0.010168514345902576)]	1
48	1	Christians should make clear that the perpetuation of objectionable vaccines and the lack of alternatives is a kind of coercion.	[('should', 0.02287923302162837), ('of', 0.004119813917465096), ('objectionable', -9.550148163891547e-05), ('that', -0.00971924313347391)]	1
49	1	Democrats really don’t want to spend billions of taxpayer dollars on a giant, ineffective border wall, so if Trump were try to come up with an offer designed to entice them, he’d have to propose something that would be (a) enormous; and (b) wildly unpopular among Republicans.	[('be', 0.02393829314385103), ('don’t', 0.007255747977366487), ('propose', 0.001491508850641371), ('them,', 0.0005961869375936635), ('Republicans.', -0.0006580904833929724), ('were', -0.002794852531836972), ('taxpayer', -0.004664230821756233), ('unpopular', -0.007866993563412372)]	1
50	0	Appearing Tuesday Cheddar Live, Rep. Maxine Waters (D) formally endorsed former Vice President Joe Biden for the White House, claiming that President Donald Trump is “destroying America” and advocating for the killing of both black and white children in the wake of nationwide protests over the death of George Floyd.	[('both', 0.01668867490275795), ('wake', 0.010752118636759822), ('white', 0.005972787561238122), ('Tuesday', 0.0032457798732992683), ('“destroying', 0.0003699413905678395), ('Waters', -0.00028062584762941436), ('Appearing', -0.0010186876871008822), ('the', -0.0027089603059414335), ('Trump', -0.008214788401019323)]	1
51	1	Before we get to work dispensing these arguments, it’s important to acknowledge that they are, on some level, understandable. A lot of Americans, especially those who got their bachelor’s degree before the early 2000s, find it baffling that younger generations can’t work their way through college.	[('get', 0.020783667568516354), ('find', 0.011682518383126903), ('to', 0.006341225585752972), ('some', 0.0029236526988552104), ('we', -0.0005376525546016864), ('baffling', -0.0020780448044797808), ('understandable.', -0.006307468998088155), ('arguments,', -0.010492213056717062)]	1
52	1	In July 2019, Rep. Alexandria Ocasio-Cortez, D-N.Y., and other Democrats visited a similar processing center in Clint, Texas, and made explosive allegations about the conditions there.	[('made', 0.04029287846298252), ('D-N.Y.,', 0.0), ('Alexandria', -0.0002649372389485383), ('explosive', -0.000654964098078008), ('similar', -0.011697763116327652)]	1
53	0	New York Attorney General Letitia James said in her complaint, filed in Manhattan federal court earlier this month, that “PHEAA’s abuses have not only denied these dedicated public servants the benefits they have earned, but have undermined the goals of the loan forgiveness program.”	[('loan', 0.011593951573285093), ('only', 0.003177061076586437), ('that', 0.0014817167625594285), ('program.”', 0.0003253379038084403), ('forgiveness', -0.0002617637680534601), ('but', -0.0022443554861547033), ('court', -0.005922426350567441), ('benefits', -0.011846554584358446)]	1
54	0	Anti-Vaxxer Rebecca Dalelio, 43, was taken into custody after she tossed a menstrual cup, which she said was filled with blood, from the public gallery as senators finished taking a vote at about 5:14 p.m.	[('after', 0.035191451832363566), ('as', 0.0060178363026928946), ('Anti-Vaxxer', 0.0009446685544077327), ('custody', 0.00011303316202226243), ('p.m.', 0.0), ('into', -0.006920017152658648)]	1
55	1	As Breitbart News most recently reported, blue-collar Americans in landscaping, conservation work, the meatpacking industry, construction industry, and fishing jobs have had their wages dragged down by foreign workers imported through the H-2B visa program.	[('As', 0.025220973994008883), ('News', 0.008679686729414982), ('visa', 0.0019332990280262463), ('conservation', -0.00025990180313240405), ('program.', -0.0025850970017636597), ('by', -0.007620329649041504)]	1
56	1	In August, Planned Parenthood made the decision to opt out of the federal family planning grant program, portraying itself as a victim of the Trump administration.	[('made', 0.02938918577927587), ('August,', 0.0060638419852947914), ('victim', 0.000688629731763406), ('program,', -0.00029301769509316956), ('to', -0.004981063237339139)]	1
57	0	Military ships and aircraft have been deployed to coastal communities in southeastern Australia cut off by raging wildfires that have raced towards the coast, trapping thousands as the death toll from the apocalyptic blazes continues to grow.	[('ships', 0.009706873228576222), ('Australia', 0.002562126846188215), ('the', 0.0014117525132011943), ('as', 0.0006141129134737044), ('coast,', -0.0004401414499814471), ('to', -0.006983948726413345), ('death', -0.01522453335822608)]	1
58	1	State health departments and legislators who sneer at parental concerns and call for vaccination mandates erode parents’ trust.	[('for', 0.024415706293739303), ('and', 0.002549089760165163), ('erode', 0.0005261783923308117)]	1
59	0	The player vote ending Thursday at midnight—a simple majority vote will determine the outcome of the NFL CBA—is a monumental referendum for the next decade of the NFL.	[('for', 0.028281359691948404), ('decade', 0.005326514390302704), ('player', 0.0020016645730010275), ('the', -0.0018444826724241458), ('midnight—a', -0.006227965719030818)]	1
60	1	Cuban slave doctors that have escaped the system have said that, while working abroad, the Castro regime forced them to invent patients and throw away perfectly good medicine to boost the statistics on the number of patients Cuban doctors actually treat.	[('working', 0.03494022993678757), ('to', 0.00882154883304765), ('regime', 0.0034176739814719926), ('Cuban', 0.0010111332700712705), ('invent', 0.00015217598380551367), ('the', -0.0003448821569616478), ('have', -0.0034314606658042935)]	1
61	1	British Olympic swimmer Sharron Davies also slammed the concept of transgender athletes.	[('of', 0.021727122596697707), ('Olympic', -0.0005146707555512964)]	1
62	1	Biden’s appearance was a contrast with the approach of Republican President Donald Trump, who has made no major public statement to address the growing crisis but issued tweets as he remained out of sight in the White House.	[('has', 0.02097473515127137), ('crisis', 0.011929286626008263), ('in', 0.005286063296506413), ('the', 0.00048032118931063295), ('a', 0.0), ('Biden’s', -0.0035309891796109103), ('address', -0.017156184348401098)]	1
