Index	true_label	text	shap	pred_label
1148	0	Job and revenue losses prompted by the coronavirus will likely accelerate the depletion of Social Security and Medicare reserves, U.S. officials said on Wednesday as they released reports showing little change in the federal benefit programs’ pre-pandemic finances.	[('prompted', 0.014642702443147389), ('Security', 0.007487217088831773), ('accelerate', 0.0034274672677101635), ('reserves,', 0.0011989232969611152), ('losses', 0.00018708198969713319), ('and', -0.0064554202989423005), ('officials', -0.022578760789475103)]	1
1149	1	Bush, who has largely avoided politics since leaving office in 2009, has recently weighed in on the Chinese coronavirus pandemic and the death of George Floyd — and while neither statement mentioned President Trump by name, they were regarded as veiled swipes at his handling of both matters.	[('both', 0.01877854444163284), ('death', 0.010537420054726087), ('office', 0.007978136991139492), ('and', 0.0022267298744504836), ('swipes', 0.0), ('the', -0.0015532814330957833), ('of', -0.0031372626675091266), ('2009,', -0.007492740142112755)]	1
1150	1	A plan known as the Fairness for High-Skilled Immigrants Act is a boon to Silicon Valley billionaires, big business elites, and outsourcing firms, as they would be able to readily import more lower-paid Indian and Chinese foreign workers to take American jobs that would have otherwise gone to American citizens.	[('citizens.', 0.03197223081608608), ('workers', 0.012010715125795445), ('and', 0.007279824351028316), ('and', 0.0048375850413197), ('a', 0.0), ('Chinese', -0.001121552340087798), ('outsourcing', -0.0025040744401423733), ('more', -0.005181973573227003), ('be', -0.00981656677040775)]	1
1151	1	It's not just governments and international organizations that have lined up to express dismay at Trump's move. Experts, entrepreneurs and others have also been quick to condemn the announcement.	[('just', 0.029593396301563896), ('organizations', 0.0042597612465478185), ('not', 0.001053584017061101), ('announcement.', -0.0004497674173341093), ('move.', -0.0030332636711947105)]	1
1152	0	Despite Portman’s insistence that she has tried to advance female directors, only one of her feature films was directed by a female.	[('Despite', 0.021319712578872156), ('directors,', 0.0011621372848351608), ('insistence', -0.00035338120912694617), ('her', -0.010710234180977109)]	1
1153	1	In the wake of the El Paso shooting, in which 22 were killed and 24 injured, the discovery of a racist manifesto that may be linked to the shooter has pushed white supremacist ideologies into prominence.	[('be', 0.014229051907230457), ('racist', 0.005635531654010122), ('in', 0.0026006019523074466), ('the', 0.0009645620680800249), ('injured,', -0.0009376443679025903), ('that', -0.0058536760131119095)]	1
1154	1	Frustrated Democrats slammed Republicans for what they see as a debacle that could leave millions of Americans without health care. 	[('care.', 0.019148876028186365), ('that', 0.008397670008300492), ('Republicans', 0.0013241011813045777), ('could', -0.009795842681476557)]	1
1155	0	An organization backed by Saudi Arabia accused several foreign countries of inciting young women to reject their families, the first public comments from Riyadh since a woman claiming domestic abuse was granted asylum in Canada over the weekend.	[('to', 0.01850671194440865), ('Arabia', 0.009242968136154071), ('woman', 0.005232244573625755), ('young', 0.0010231230855389673), ('reject', 0.0004273447349023796), ('the', -0.0028422716449908536), ('domestic', -0.008758176840266925)]	1
1156	1	This is what Breitbart News has reported, based on publicly available data ignored by the anti-tariff crowd for over a year. 	[('This', 0.030854003742804094), ('for', 0.009443371364486423), ('has', 0.0045663129051799435), ('data', -0.0011397200243495698)]	1
1157	0	Berlin is trying to stop Washington from persuading a German company seeking a coronavirus vaccine to move its research to the United States, prompting German politicians to insist no country should have a monopoly on any future vaccine.	[('should', 0.0210505075190215), ('is', 0.004841623965859637), ('insist', 0.0016010708854372168), ('a', 0.0), ('Washington', -0.0032363003629694996), ('to', -0.006215944689110019), ('from', -0.009098999196295325)]	1
1158	1	There was no immediate confirmation from US officials about the alleged plan to slash US troop numbers in Germany and cap them at 25,000 in future. But Trump’s lukewarm support of longstanding cooperation agreements with European allies has long caused alarm on the continent.	[('25,000', 0.021153194967464987), ('to', 0.011975206461305857), ('Germany', 0.008159281700846845), ('confirmation', 0.0013767272698121725), ('the', -0.00012569644175148943), ('long', -0.0009179930558472881), ('But', -0.003925854098682643), ('Trump’s', -0.010832028708355172)]	1
1159	1	Holding a face mask draped over a pen in his left hand, and reading from a script evidently placed slightly off-camera, Biden labored through a presentation that sought to portray Trump as a plutocrat serving his cronies.	[('through', 0.01408237673343601), ('Trump', 0.004027113810861547), ('script', 0.0008439870554065698), ('a', 0.0), ('draped', -0.0004171123134223209), ('serving', -0.004430378817451812), ('over', -0.011289194898061327)]	1
1160	1	But instead of closing loopholes that allow criminals to access firearms, the bill by House Democrats could turn millions of law-abiding American gun owners into felons.	[('to', 0.024162031432589385), ('gun', 0.01014405503821463), ('criminals', 2.0830773884873422e-05), ('millions', -0.0019012620925899215), ('of', -0.006818987105816897)]	1
1161	1	Finally, he launched into a meandering rant about Biden, suggesting that under the Obama administration, nothing was done to fix policing in the United States. While the previous administration surely didn’t do enough, and Biden himself has contributed to the criminal justice problems in the country, Trump completely ignored the fact that the Obama Justice Department actually did take significant steps toward reform following the protests in Ferguson.	[('While', 0.0287110830718992), ('enough,', 0.011772184802492685), ('Obama', 0.00905851145972644), ('justice', 0.00416217857370214), ('Department', 0.0026719963369963573), ('to', 0.0013706039436842876), ('completely', 7.666975836489675e-05), ('contributed', -0.0005781433268984404), ('the', -0.0014934815598358886), ('the', -0.0023794294826999253), ('into', -0.005231507528111281), ('rant', -0.009712354343246507)]	1
1162	1	Earlier this month, US President Donald Trump said US special forces would be withdrawn from northern Syria, in what was widely seen as betrayal of the Kurds and a green light for a Turkish attack.	[('this', 0.02351989577254744), ('the', 0.005307333494597665), ('Syria,', 0.0016106602143495963), ('attack.', -0.0002627321569412233), ('Kurds', -0.002408747831424265), ('in', -0.007219488765498505)]	1
1163	1	Before President Donald Trump threatened to violently suppress demonstrations in memory of Floyd, before the spread of recording equipment let the world witness how U.S. police brutalize non-white bodies and before “I can’t breathe” became a global rallying cry challenging American cruelty and injustice, America tried to explain its racism to the world.	[('non-white', 0.046093460407778196), ('how', 0.009187764140358781), ('its', 0.00352580125281275), ('racism', 0.0017394162182761807), ('U.S.', 0.0), ('threatened', -0.0005075549450549488), ('the', -0.001417392356071605), ('cry', -0.001756379128864679), ('Trump', -0.009250643694507373)]	1
1164	0	Overall, four million young Americans enter the workforce every year, but their job opportunities are further diminished as there are roughly two new foreign workers for every four American workers who enter the workforce.	[('new', 0.02527538427288186), ('the', 0.0038764457345589398), ('foreign', 0.0023229382357684092), ('diminished', 0.0009082907003499696), ('young', -0.002591287424060533), ('are', -0.0095756230203474)]	1
1165	0	Facebook bans white nationalism from platform after pressure from civil rights groups.	[('civil', 0.027270226966066898), ('white', 0.006085654387541194)]	1
1166	1	We don’t need to embrace full-on socialism communism, and Ocasio-Cortez is swift to say that, but the floor needs to come up and the ceiling needs to come down.	[('floor', 0.024892176471099994), ('come', 0.007789092710781073), ('socialism', 0.003981100512965157), ('the', -0.0013285228189001729), ('don’t', -0.006664629209579679)]	1
1167	1	Conspiracy theories about the Sandy Hook shooting have persisted for years, for example, far-right InfoWars host Alex Jones claimed that the whole thing was staged by the government with child actors and no kids were harmed ― which ultimately led to a lawsuit against him by parents of the victims.	[('about', 0.021902366747628355), ('led', 0.006934617107030896), ('by', 0.0013563155122995718), ('victims.', 0.0008198040784247662), ('persisted', 7.935984248683581e-05), ('lawsuit', -0.0006324695813457659), ('Conspiracy', -0.0019514604959071668), ('shooting', -0.006558018684162979), ('with', -0.019537206748527505)]	1
1168	1	It is no wonder why Republicans insisted on ramming through incredibly unpopular tax cuts for American corporations that were already making near-record profits, even at the risk of losing control of the House of Representatives. 	[('It', 0.02790094334466999), ('of', 0.006054403419058622), ('is', 0.0037864373326259725), ('profits,', 0.0006895219136605723), ('corporations', -0.00416196067027321), ('for', -0.010292433524944673)]	1
1169	1	White nationalist arrested for alleged threat against Ohio Jewish community center.	[('Jewish', 0.02726734220608985), ('against', -0.000366298860564499)]	1
1170	1	It may have taken Trump to point out the pitfalls of the Chimerica link, but coming up with a coherent strategy to replace it is clearly beyond the president’s abilities.	[('it', 0.024484184654533836), ('is', 0.004092746541152469), ('a', 0.0), ('abilities.', -0.002591313803760401), ('to', -0.00917186978417533)]	1
1171	0	Kate Brown, an out bisexual, made history in November 2016 when she became the first openly LGBTQ person to ever be elected governor of a U.S. state. 	[('she', 0.02155243869938387), ('governor', 0.011423177547314254), ('U.S.', 0.0), ('ever', -0.0047898339931842894), ('in', -0.010694613246854638)]	1
1172	1	The president has failed miserably at handling the first serious challenges of his presidency: COVID-19 and the racial justice protests, Conway charged. They have not only revealed the incompetence of the “failing, flailing” president, but his inhumanity as well, Conway argued.	[('well,', 0.02752629031288846), ('of', 0.008754114239680658), ('inhumanity', 0.0022043934290640545), ('flailing”', 0.0008505046940413019), ('president,', -0.000446562716995843), ('The', -0.005724873540496853), ('presidency:', -0.009414054181041583)]	1
1173	1	But rather than appreciate the fact that Asian-American women are considered highly attractive, Lim sees only a sneaking racial bias, a reflection of our upside-down cultural world where victimhood and oppression carry more social currency than even beauty and success.	[('are', 0.018669676627613353), ('our', 0.007803170482858297), ('success.', 0.0013806047080223193), ('a', 0.0), ('social', -0.00031406802776933975), ('only', -0.002081871345029227), ('world', -0.0071049575010333375)]	1
1174	0	He even wants a son to get a background check before a father can give him a gun as a gift.	[('give', 0.01595653780213571), ('get', 0.011311557641805548), ('a', 0.0), ('him', -0.006829813160584055)]	1
1175	1	Trump is nothing if not a public relations savant. Once the dust settles, if he cannot take credit for restoring order, he’ll do his best to deflect and lay the blame at someone else’s feet. He’ll remind his followers what the other side thinks of them, how they desecrated our American values, and what will happen to them if Joe Biden becomes the apologizer-in-chief.	[('He’ll', 0.03208346000056281), ('he’ll', 0.011492691381949287), ('public', 0.006985960798460779), ('for', 0.004148235343801796), ('Once', 0.0017640254237288066), ('the', 0.0014912630895563394), ('a', 0.0), ('if', -0.0002456533130700267), ('if', -0.0016702510704209405), ('else’s', -0.0067143370721619), ('Trump', -0.01103044978339262)]	1
1176	1	Women in power must pay a significant tax on their limited time to sit for manicures, blowouts, brow waxes, and braids, rather than meeting with constituents, reviewing legislation, conducting investigations, chasing a story, traveling to their districts, reviewing their notes, or spending time with their families.	[('significant', 0.015502992909452505), ('pay', 0.004420017220724777), ('meeting', 0.001201924778985417), ('a', 0.0), ('reviewing', -2.934635801836505e-05), ('time', -0.00037264481550196125), ('legislation,', -0.002981141950009104), ('with', -0.010228039832285114)]	1
1177	1	"In an apparent attempt to blame sexism for the blowback the Rashida Tlaib received for her ""Impeach the Motherf*cker"" remark, Pelosi wondered aloud what the response would have been if a man made the same comment. "	[('to', 0.0187679433077447), ('remark,', 0.008566543405203141), ('wondered', 0.0010941157902699362), ('blowback', 0.0005446277501617847), ('aloud', -0.0002832049904108158), ('the', -0.0026131796735582025), ('made', -0.04174932676817887)]	1
1178	1	Just a few weeks later, our divided leaders were taken by surprise by the pandemic, and bickered on cable news, asking why nothing was done sooner.	[('cable', 0.017553821333361277), ('pandemic,', 0.004450820056439657), ('taken', 0.00043957771401980316), ('by', -0.002418233885275205), ('and', -0.014490096784830892)]	1
1179	0	Jones, founder of the Infowars radio show and webcast, has claimed the mainstream media and gun-control proponents conspired to fabricate the tragedy in which 20 school children and six school staff were shot dead at Sandy Hook Elementary School in Newtown, Connecticut, on Dec. 14, 2012.	[('in', 0.01800495764291057), ('gun-control', 0.009301886130427133), ('Sandy', 0.007534963703881077), ('on', 0.0044243715604715276), ('Elementary', 4.628922328888452e-05), ('Hook', -0.0003970819126533642), ('the', -0.0020510908797701367), ('founder', -0.008511398836761984)]	1
1180	0	In a bid to stop the spread of the virus, Malaysia’s religious affairs minister has issued guidelines for holding Friday prayers at mosques, including shortening sermons and for the wudhu, or ablution rites, to be carried out at home if possible.	[('spread', 0.034921168508266424), ('bid', 0.005973173540754169), ('the', 0.0017392291565876405), ('prayers', 0.0007532772185115255), ('ablution', 0.0), ('including', -0.004845072231215168), ('for', -0.008186443653482013)]	1
1181	0	During Tuesday’s Democrat debate in Des Moines, Iowa, Sen. Elizabeth Warren (D-MA) described Sen. Bernie Sanders (D-VT) as her “friend” despite framing him as a sexist who denied the possibility of a woman being elected president of the United States.	[('denied', 0.016616646301608376), ('Democrat', 0.01105862463755119), ('framing', 0.0007957747543461902), ('Moines,', 0.0001280695189817016), ('the', -0.0006961965939953373), ('president', -0.002173320435662365), ('of', -0.006824180209724222)]	1
1182	1	The Trump regime appears to have given up on containing the outbreak and is just focusing on managing the political fallout. This week, the White House rejected its own sensible, science-based guidelines to re-open states, and Trump has left it up to governors to decide how and when to reopen their economies.	[('focusing', 0.024707647291658422), ('re-open', 0.011326476203076774), ('managing', 0.002426134711286434), ('guidelines', 0.0007070641025145918), ('appears', -0.00042043390625938205), ('their', -0.002382129622152259), ('left', -0.0034509982934557825), ('week,', -0.004610626547582998), ('just', -0.011906593794854013)]	1
1183	0	Noir was reacting to the massive gun-rights rally in Richmond, where thousands of people from across the country protested a push by Democrats in the commonwealth to pass more comprehensive gun control laws.	[('push', 0.032796076015762586), ('commonwealth', 0.003759054739577611), ('the', 0.001392672149653289), ('people', -0.0019849708954399457), ('protested\xa0a', -0.00984837570299264)]	1
1184	0	Trump signed a GOP tax bill in 2017 that cut taxes for the middle class but delivered a larger tax break for the wealthiest Americans.	[('bill', 0.02087575304525765), ('the', 0.004768927895470911), ('a', 0.0), ('signed', -0.007656910413495329), ('for', -0.015943679746757363)]	1
1185	0	In their articles of impeachment here , Democrats charge that Trump abused his power as president by pressuring the government of Ukraine to help him win re-election. They accuse the president of endangering the U.S. Constitution, jeopardizing national security and undermining the integrity of the 2020 election.	[('security', 0.023812501260415536), ('In', 0.014045772404767294), ('election.', 0.0024485923230463), ('U.S.', 0.0), ('Ukraine', -0.0005184493445021055), ('the', -0.0012009159812933412), ('the', -0.003110372668128628), ('Constitution,', -0.008533341769832958)]	1
1186	1	It matters that figures like Marsha Blackburn are trying to smear a decorated American war hero. It also matters why she's engaged in such a toxic scheme.	"[(""she's"", 0.017816677322532847), ('that', 0.0015011498664984357), ('smear', 0.00021588361827969303), ('toxic', -0.0007576964864491598), ('also', -0.01344981235649851)]"	1
1187	1	The startling, aggressive attacks on peaceful protesters by the National Guard occurred after a “pointed threat” from the Pentagon that if the Guard couldn’t handle the situation, active-duty military units would be sent to deal with civilians, the Times reported.	[('sent', 0.02286461893117597), ('by', 0.008889164782627182), ('the', 0.0014128148482421409), ('Pentagon', 6.393460643709714e-05), ('Times', -0.00037647819026052963), ('would', -0.003195245527759795), ('units', -0.010197049117452006)]	1
1188	1	If she doesn't want to thank him for his honorable service, that's her business, but these ugly attempts at smearing him are unbecoming of those in positions of authority.	[('of', 0.011829586925827867), ('unbecoming', 0.00862817896783101), ('smearing', 0.005076389680139096), ('but', -0.00010399957516702751), ('positions', -0.00848779043875422)]	1
1189	1	In Europe, no government has joined Trump’s anti-Iran crusade (though John Bolton is whispering in the ear of the new Trump-loving prime minister, Boris Johnson.)	[('new', 0.038558511796255114), ('Trump’s', 0.007082706545170115), ('crusade', -0.000477138129376643), ('in', -0.008658057306230552), ('anti-Iran', -0.018369257154733545)]	1
1190	0	Russia’s central bank suspended gold purchases on the domestic market from April 1, without giving a reason. However, analysts have suggested it is focusing on foreign currency sales to support the rouble, which has fallen in line with lower oil prices as the virus spread.	[('spread.', 0.031764930382455606), ('Russia’s', 0.006864510907145603), ('the', 0.0025994725290344268), ('April', 0.0013146316605738351), ('a', 0.0), ('is', -0.0011874653690769966), ('lower', -0.004225705322271631), ('fallen', -0.014181808818572277)]	1
1191	1	In Tuesday night's debate, the two progressive senators de-escalated a tense round of tit-for-tat exchanges between their presidential campaigns over the charged issues of gender and electability.	[('de-escalated', 0.031586256584331965), ('charged', 0.005625785131378336), ('gender', 0.0005828496595324628), ('senators', -0.0006559574068653485), ('over', -0.01718818650386412)]	1
1192	0	After dozens of mass shootings in recent years, however, including at schools like the February 2018 massacre in Parkland, Florida, that left 17 dead, curbing gun violence has become a component of the Democratic policy platform embraced by congressional and presidential candidates.	[('presidential', 0.03928545826796075), ('policy', 0.007364182721736081), ('dozens', 0.002291302854133559), ('by', 0.000987838545602996), ('recent', -0.00011649251132010096), ('at', -0.006413532327692738), ('years,', -0.010445378756339625)]	1
1193	1	Warren’s speech included leftist talking points — from corporations’ alleged mistreatment of American workers and unions to the dangers of “cutthroat capitalism” and the pitfalls of free trade.	[('alleged', 0.015548148526299559), ('talking', 0.00934280380364097), ('and', 0.0057903307022652605), ('mistreatment', -0.0011699001596399217), ('of', -0.0031543983620984394)]	1
1194	1	During that address, Lindell, a former drug addict turned born-again Christian who has donated more than $200,000 to Trump’s election efforts, went off-script, proclaiming to the nation that Trump had been “chosen by God.”	[('address,', 0.01518813459947679), ('Trump', 0.003144746675406509), ('turned', 0.0012850894198022278), ('donated', -0.0005429634825528873), ('that', -0.005455790980236986), ('$200,000', -0.009635011080017679)]	1
1195	1	Newly empowered Democrats in Washington and statehouses across the country are flexing their legislative muscle with a host of tax proposals that would affect billionaires and blue collar alike.	[('country', 0.02266515762613898), ('legislative', 0.007152088849923818), ('in', 0.003302860540170318), ('Democrats', -0.00229007202377547), ('Washington', -0.013830219469827265)]	1
1196	1	While the workaday majority of Americans continue to be mired in our low-wage economy, the precious few at the tippy top soared out of sight in 2019.	[('be', 0.019010904285668154), ('Americans', 0.003519868424635055), ('economy,', 0.0012219653444190336), ('to', -0.00045268174323696343), ('our', -0.013017729658545424)]	1
1197	1	Bernie Sanders Is Crazy, But The Only Democrat Candidate Voters Actually Like	[('Like', 0.015601655128511204), ('Actually', 0.00017370892018779173)]	1
1198	0	Lisa Nandy, the Member of Parliament for Wigan and one of the three remaining candidates in the Labour leadership race, said that men who identify as women, like convicted child rapist Christopher Worton, who now identifies as Zoe Lynes, should be able to be transferred into female prisons.	[('now', 0.02782790869261455), ('transferred', 0.010731838806633864), ('women,', 0.003702416238890983), ('prisons.', 0.001740708760414559), ('Christopher', 0.0006366180386203435), ('Worton,', 0.0), ('the', -0.002240512153212222), ('who', -0.00859392673311044)]	1
1199	1	The irony, of course, is that the exhibit that invites people to throw trash at vacuuming Ivanka Trump lookalike reflects every stereotype feminists claim to stand against, oversexualizing Ivanka’s body and ignoring her hard work.	[('stand', 0.011962264088689428), ('body', 0.007182659735489724), ('her', 0.005134849164437807), ('trash', 0.0005964847607230795), ('reflects', -0.0006778687547236539), ('is', -0.0027908174053741354)]	1
1200	0	That is because much of what Newsom and the Democrats value in California has to do with good intentions, rather than real-world results.	[('with', 0.015273085981104838), ('much', 0.008529620878273187), ('and', 0.0006593597983720878), ('rather', -0.0025654545294258478)]	1
1201	0	The gruesome three-hour incident occurred between students of Jawaharlal Nehru University, who were protesting a fee hike on education, and youth wing members of Rashtriya Swayamsevak Sangh, a group closely tied to India's ruling Bharatiya Janata Party (BJP).	[('tied', 0.01679797955902613), ('students', 0.008087732838694317), ('education,', 0.0021633296508974677), ('a', 0.0), ('group', -0.0015120740775135465), ('three-hour', -0.007687093342083228), ('ruling', -0.01423355867455617)]	1
1202	1	Until recently, there seemed to be no broader plan behind NeverTrump’s early, and vigorous, opposition to Trump and his administration. But the contours of a plan have begun to emerge, particularly on social media, where the movement’s criticism of Trump alternates with praise for some of his opponents in the 2016 Republican primary.	[('seemed', 0.012337079779713728), ('Until', 0.008108569054684848), ('behind', 0.003971949568427265), ('the', 0.002481126964212996), ('opponents', 0.0011164276195949497), ('2016', 0.00046999221288856807), ('to', -0.0011316943251233414), ('Republican', -0.003314117364117379), ('and', -0.009565852557512437)]	1
1203	0	The Labour politician, who has presided over an epidemic of violent crime — particularly knife crime — and the extension of London’s illegal drugs trade into surrounding areas ...	[('into', 0.008910632966216178), ('London’s', 0.0037058126232381583), ('knife', 0.0009920210884311552), ('...', 0.0), ('trade', -0.006748383103535404)]	1
1204	1	Perhaps that is why both Warren and Sanders have gone out of their way to hammer home the fact that their proposals would only affect the wealthiest Americans.	[('is', 0.013977706312711016), ('out', 0.004999778746691983), ('Americans.', 0.0012171938952517092), ('Warren', -0.0017706326741771838), ('Perhaps', -0.010125595607866428)]	1
1205	1	Even if you don’t speak white nationalist dog whistle, this speech is pretty shocking. Hawley is claiming that the United States is run, and has been run, by a secret group of international “elites” who value terrible things—such as education, achievement, and progress.	[('United', 0.03134109828896045), ('is', 0.006714039971723149), ('shocking.', 0.0036727195341445195), ('“elites”', 0.00191303376053221), ('if', 0.0006051250868316893), ('has', -0.00019770206506634967), ('been', -0.007246348876493325), ('things—such', -0.02306705934653409)]	1
