Index	true_label	text	shap	pred_label
362	1	Due to global overpopulation, giving birth is the worst thing you can do to the planet, MacCormack sustains, while insisting that she is not advocating wiping out the existing population but rather letting it die off.	[('out', 0.01859409688352544), ('is', 0.004414203983902148), ('the', 0.0010292630220932154), ('to', -0.0012122269759300664), ('insisting', -0.0023176014409766387), ('that', -0.005574567012157275)]	1
363	0	With the Olympic Games postponed until 2021 and cinemas closed across the country, whole segments of the advertising market have evaporated.	[('country,', 0.022327151370734884), ('the', 0.0027591306486925305), ('postponed', -0.0012199606707648481), ('and', -0.014772776037954316)]	1
364	1	The movement’s hysteric leader proceeded to hush the crowd so the mayor’s answer could be heard across the streets so they could vote him out next year if he bowed to their anarchic demands.	[('their', 0.02136054839494856), ('movement’s', 0.008342285172107422), ('bowed', 9.380941657313179e-05), ('could', -0.0012216778087114145), ('hush', -0.0025142070428547593), ('so', -0.010219470445133801)]	1
365	1	So it appears McCabe is allowed to lie to federal investigators about corruption affecting the U.S. government, cover it up with more lies, and get off scot-free even though what he did is a crime, while Stone faces years in prison for lying about gossip that affected nothing of public importance.	[('for', 0.02417968849170455), ('investigators', 0.013407578893667444), ('So', 0.007792593995272828), ('prison', 0.00429399336118504), ('scot-free', 0.0019745267122608756), ('lie', 0.0008416593288634377), ('he', -5.227854582693703e-05), ('is', -0.007149864904797789), ('it', -0.014030820461344873)]	1
366	1	As people sip cafecito and eat croquetas at the landmark restaurant, the buzz here these days is what Cubans say is the alarming rise of Democratic presidential frontrunner Sen. Bernie Sanders, whose unabashed defense of late Cuban dictator Fidel Castro has riled Cuban-Americans who view his comments as a personal attack.	[('presidential', 0.02805981063054592), ('his', 0.007247769848349666), ('Democratic', 0.003044312169312149), ('what', 0.0012908109920410805), ('late', 0.00018148148148148025), ('Fidel', -4.235262871704504e-05), ('the', -0.001086458635703913), ('Cuban-Americans', -0.0028152325101894306), ('As', -0.019456608925737914)]	1
367	0	After health officials near Portland, Oregon, declared a public health emergency over a measles outbreak that affects mostly young children, the viral infection continues to spread.	[('spread.', 0.045242101748394915), ('viral', 0.0004887452290400352), ('a', 0.0), ('that', -0.005760392273101499), ('After', -0.012708657121063997)]	1
368	0	Brooklyn measles outbreak: How a glossy booklet spread anti-vaccine messages in Orthodox Jewish communities	[('spread', 0.03928286055858523), ('Orthodox', 0.0016018723420361414), ('communities', -0.0014388445470206567)]	1
369	1	"The Utah Republican Sen. Mike Lee honed his inner troll while using everything from posters showing Aquaman and Star Wars characters to quotes from Austin Powers to paint the Green New Deal bill as ""ridiculous"" and something that would never pass in Congress and never work. "	[('something', 0.03999442885451975), ('his', 0.00922319428945698), ('never', 0.0029459849208043555), ('characters', 0.0016503359427691988), ('posters', 6.986324958994316e-05), ('and', -0.002153179970578618), ('and', -0.005102123260206264), ('Utah', -0.008195138870192117)]	1
370	0	Pro-Life Advocates Lay 3,000 Flowers Outside SCOTUS to Remember Preborn.	[('Outside', 0.008621444840517125), ('Lay', 0.0)]	1
371	1	The movement to ban or limit the use of natural gas in commercial and residential buildings opens a new front in the fight against climate change that could affect everything from heating systems in skyscrapers to stoves in suburban homes.	[('ban', 0.02935176578949755), ('limit', 0.012729886854887507), ('the', 0.0019299110312989364), ('opens', 0.00023671068964483788), ('in', -0.0034914749411614197), ('and', -0.005471965797477206), ('against', -0.011376062462464554)]	1
372	1	The anti-vaccination community holds to an unscientific conspiracy theory that childhood vaccinations are toxic and cause numerous illnesses and injuries, including autism, and spreads these beliefs through YouTube, Facebook and other online platforms.	[('Facebook', 0.03212952226243512), ('childhood', 0.010252008273485809), ('autism,', 0.0006298204474829194), ('beliefs', 6.164706489036331e-05), ('other', -0.002242822886850876), ('illnesses', -0.010775132158943119)]	1
373	1	While the major baseball leagues won’t be affected much by tariffs on Chinese imports, everyone from Double A players down through the office softball team will be.	[('While', 0.034567507876754076), ('everyone', 0.001742652750266529), ('A', 0.0), ('players', -0.002069579377103782), ('through', -0.011583686025517341)]	1
374	1	But she couldn’t shake criticism that she was an outsider compared to Leger Fernandez, who has served as counsel to several Native American tribes in the northern New Mexico district and had the backing of the Congressional Hispanic Caucus.	[('Mexico', 0.01658171192193217), ('counsel', 0.008114058303527504), ('an', 0.0043840259990253864), ('compared', -0.00012993604922257096), ('Native', -0.001808365497794867), ('tribes', -0.0025938158943825985), ('she', -0.007159996828363155)]	1
375	1	This includes children that officials have stolen from their families, done so with full knowledge that family separation and detention cause long-term harm to children, and done so with the fact that for the first time in years, migrant kids have died under U.S. watch.	[('officials', 0.020107853853256162), ('cause', 0.009856697760328183), ('harm', 0.005267901459754282), ('done', 0.0016407714069166946), ('U.S.', 0.0), ('kids', -0.0010629178218774914), ('have', -0.002757813988946063), ('knowledge', -0.009331429615187159)]	1
376	1	Some of the liberal opposition is often grounded in the mistaken belief that Warren’s plan would do more to reduce the racial wealth gap than Warren’s. The opposite is true: full cancellation would reduce the racial wealth gap more than Warren’s plan would. 	[('full', 0.02526360153916683), ('Warren’s', 0.0027603659999728934), ('wealth', 0.001480885939824671), ('plan', 0.00017828536274429817), ('would', -0.0016852846543974776), ('would', -0.002868085174026643), ('often', -0.004118146307543464), ('to', -0.010985270622354661)]	1
377	1	Pope Francis issued a severe indictment Wednesday of humanity’s failure to care for the planet, as environmentalists commemorate the 50th anniversary of “Earth Day.”	[('of', 0.013718836014879745), ('Pope', 0.0014038309710980113), ('Francis', 0.00019495301880154026), ('as', -0.007080995616089579)]	1
378	0	Doctors say over-usage of the body in competitive, year-round sports programs is to blame for a rapid rise in major injuries among youth athletes nationwide.	[('for', 0.021461784765932836), ('to', 0.010933488349360405), ('Doctors', 0.0009221683597867925), ('competitive,', -0.001059746829046172), ('of', -0.013687641063222695)]	1
379	1	Here’s an irony: Thanks to Roe, America is a whiter place than it would otherwise have become. If pro-lifers had had their way, on the other hand, America would be considerably blacker and browner than it is today.	[('become.', 0.01883986596575661), ('is', 0.005641585400356542), ('America', 0.0023870532377827415), ('considerably', -0.0005155693828307428), ('their', -0.0019331462183002723), ('had', -0.005179698343301864), ('place', -0.011171018707322072)]	1
380	0	Most are fleeing endemic poverty and increasing rates of gang violence.	[('of', 0.022725931212776277), ('Most', -0.0007795294367071314)]	1
381	1	In an article posted by NBC News on Monday, the AP argues that even erstwhile allies, like tennis great and gay activist Martina Navratilova, can become resentful of transgender women dominating their sport.	[('like', 0.024891249791005023), ('can', 0.012490085151071034), ('erstwhile', 0.00550030353459255), ('posted', 0.0017493777939530753), ('the', -0.00549411409538519), ('AP', -0.01236512150837345)]	1
382	1	"""Orange Is the New Black"" star Yael Stone is renouncing her U.S. green card to return to her native Australia in order to fight climate change."	[('native', 0.01471762458530941), ('New', 0.0031547025114585813), ('star', -0.0003106445597334473), ('Australia', -0.0021809529222640354), ('change.', -0.01668817394756876)]	1
383	1	A report by the United Nations (UN) falsely blamed President Trump for the detention of 100,000 migrant children who, in fact, were held in federal immigration custody in 2015 by President Obama.	[('of', 0.011613558069748054), ('Obama.', 0.004751686573087523), ('detention', 0.0007309839106345018), ('held', -0.0012554498381488698), ('President', -0.0045132803787725165), ('100,000', -0.02264007925876924)]	1
384	1	Hotez said anti-vaccine groups are seizing on the anti-government sentiment stoked by conservative-leaning protesters to advance their cause.	[('conservative-leaning', 0.030875090717305362), ('sentiment', 0.004060225699801261), ('seizing', -0.0001927837431178092)]	1
385	1	House Republicans are gearing up for a sustained push to expose leftist Democrats in the House Democrat majority on their increasingly extreme views on abortion.	[('push', 0.032432440001215534), ('majority', 0.0026963340350024357), ('a', 0.0), ('Democrat', -0.004490868962100722), ('are', -0.027650457669224294)]	1
386	1	If task force candidates from these organizations were absolute non-starters for presumptive presidential nominee Joe Biden, because they want to treat people who have committed crimes with too much human dignity, Sanders could instead have turned to an array of “progressive prosecutors.”	[('presidential', 0.033451174175964056), ('If', 0.00757400273925698), ('nominee', 0.0036612745492055755), ('dignity,', 0.0007997203720483092), ('they', -0.0012793857576517288), ('Joe', -0.004467601983322051), ('candidates', -0.011566611474485242)]	1
387	0	That statement, while true, could leave some listeners with the wrong impression. Warren’s plan would cancel at least some student debt for 95 percent of debt holders, and all debt for 75 percent of borrowers (the source of Vice’s erroneous headline).	[('statement,', 0.02675444121685504), ('of', 0.007189928850592576), ('(the', 0.0014804411311958442), ('holders,', 5.6057796975296225e-05), ('percent', -0.0012875959539921634), ('some', -0.0040103503268422245), ('would', -0.010427616052467505)]	1
388	1	Bennett is seen immediately unleashing a tirade against Pan as he walks beside the politician, who tries to ignore, then laugh off his antagonist.	[('his', 0.01082936861928834), ('he', 0.0012299372238193185), ('laugh', -0.0005919959423398558), ('walks', -0.0023834070835159595)]	1
389	0	The government urged unvaccinated families to hang a red cloth or flag outside homes as a signal for help, and imposed the shutdown to free up resources for its vaccine drive and keep even those fearful of vaccines home for the teams’ visits.	[('government', 0.015745419709281557), ('the', 0.0037888258591424616), ('homes', 0.0005444252409041139), ('unvaccinated', 0.0), ('home', -0.000469348813621171), ('families', -0.0036032398891019503), ('to', -0.007641576482195368), ('even', -0.017373844135923508)]	1
390	1	The Trump administration gave the Border Patrol unchallengeable authority over migrants seeking asylum by invoking a little-known power given to the Centers for Disease Control and Prevention, the U.S. public health agency, to ban the entry of people or things that might spread “infectious disease” in the U.S.	[('spread', 0.036095898104223666), ('or', 0.008538094757677042), ('“infectious', 0.002191204998333297), ('disease”', 0.0012487429616945156), ('authority', 0.00033501369013431146), ('entry', -0.0003144524362404555), ('gave', -0.006284389899506152), ('that', -0.010465201690401531)]	1
391	0	"Yes, there may still be time for the union's membership to change its thinking if the players reject the proposal, but at least one marketing expert said a ""no"" vote now could mean short- and long-term disaster."	"[('""no""', 0.016776217501342103), ('Yes,', 0.008214237167778183), ('but', 0.004593060361885055), ('thinking', 0.0013449516539697725), ('reject', -0.0004969994041728543), ('the', -0.002375314998401026), ('disaster.', -0.02687461026158725)]"	1
392	1	CNN national correspondent John King ripped President Donald Trump for not mentioning climate change in his second State of the Union address.	[('his', 0.023219633356109704), ('the', 0.006421552975326572), ('climate', -0.00027048583036724414), ('President', -0.014114939866021737)]	1
393	0	Democratic presidential candidate Joe Biden promised black community leaders in Delaware on Monday he would earn their support amid nationwide police brutality protests, saying he would create a police oversight board within his first 100 days in the White House.	[('presidential', 0.033965615324028475), ('their', 0.008951730531104467), ('100', 0.0037946601065893494), ('the', 0.00044838837316611534), ('in', -0.0004841334684026244), ('he', -0.004772428791918682), ('House.', -0.017960110984986358)]	1
394	1	The false messages that they say convinced hundreds of New Yorkers not to vaccinate their children weren’t spread in a Facebook group or on YouTube, but through a glossy magazine written by and for Orthodox Jewish parents.	[('spread', 0.03729437002442314), ('but', 0.007669987033435164), ('or', 0.0029693664883351724), ('magazine', 0.00034378829759664886), ('not', -0.003122184045364643), ('weren’t', -0.006969422163050232), ('Facebook', -0.022183050459240943)]	1
395	0	But decades of study have shown no link at all, and scientists are becoming increasingly impatient with the refusal to accept their findings.	[('no', 0.025318713689881846), ('and', 0.011585581972037559), ('have', 0.0010400798266770993), ('link', -0.002924037107201073)]	1
396	1	Last week, the House Judiciary Committee moved forward with plans for an expansive investigation into Trump World abuses, prompting White House Press Secretary Sarah Huckabee Sanders to release a rather intemperate press statement.	[('statement.', 0.017678887884523434), ('Sarah', 0.0024896976319424935), ('Last', 0.0005977265512064989), ('plans', -4.646464646464676e-05), ('Press', -0.002624727138959684), ('for', -0.012286191749572668)]	1
397	1	President Donald Trump in an interview on Wednesday ripped former Vice President Joe Biden for failing on race relations, after 43 years in public office.	[('for', 0.02458475664587169), ('President', 0.009568830175727776), ('interview', 0.005113114707288356), ('Biden', -0.0009768748327763466), ('43', -0.014752732183868522)]	1
398	1	On Wednesday, democrats got a chance to grill President Donald Trump's point person on deregulation as Andrew Wheeler came to Capitol Hill for his confirmation hearing to be the next permanent administrator of the Environmental Protection Agency.	[('came', 0.01893404231233888), ('Agency.', 0.007216507082258301), ('Environmental', 0.0035090883270267425), ('democrats', 0.0018985859635036462), ('next', -0.00141622252408802), ('to', -0.008174182031577113), ('for', -0.031962884976060695)]	1
399	1	For most of his presidency, the Republican has demanded sharp cuts to legal immigration, and has made this a non-negotiable element of any deal.	[('made', 0.045226760616273946), ('the', 0.003948722231959603), ('and', -0.0017915095063604912), ('For', -0.01065382038545832)]	1
400	1	Sen. Steve Daines, a Republican from Montana, announced during the March for Life rally Friday that he has launched the first pro-life caucus in the U.S. Senate.	[('pro-life', 0.02530360976268499), ('the', 0.0031802474327454755), ('a', 0.0), ('Senate.', -0.0033786039870272997), ('first', -0.012015127049574977)]	1
401	1	They came to the United States from all corners of the globe -- Somalia, Rwanda, El Salvador, the Balkans, Germany, Iraq -- claiming to have been persecuted but, in reality, they were the persecutors.	[('been', 0.016303961627467296), ('to', 0.007549765640206292), ('in', 0.00024396384745965284), ('Somalia,', -0.001228022793760798), ('corners', -0.0021173324504599154), ('Salvador,', -0.005370267603006469)]	1
402	1	The rollback of National Environmental Policy Act (NEPA), called an “international treasure” by one former EPA official, will allow the fossil fuel industry to quickly get approval for new projects that could send climate-warming, pollution-causing emissions into surrounding communities, as well as harm wildlife habitats and federally protected lands, with scant oversight.	[('well', 0.026138277859335982), ('National', 0.007513823105652459), ('by', 0.0031497813696187314), ('federally', 0.0019112926647138284), ('Policy', 0.0005577614640422579), ('send', -0.0009625566004876373), ('The', -0.005587522163346075), ('with', -0.007032524707996407), ('that', -0.015877901282264767)]	1
403	0	Days after suffering a horrifying injury during an NCAA gymnastics regional event, a senior gymnast from Auburn University revealed Monday she is retiring from the sport.	[('after', 0.020418090580278738), ('Auburn', 0.004525764855105689), ('is', 0.001637100102974174), ('a', 0.0), ('revealed', -0.00759756297350564)]	1
404	1	"Restrictions to health care organizations that work on family planning as known as the global gag rule does extensive harm to women, especially in developing countries, but it’s nevertheless been embraced by every recent Republican administration.
"	[('but', 0.016287306258312078), ('planning', 0.0048406365383577695), ('Restrictions', 0.002294178213739645), ('embraced', 0.00013412500349559874), ('health', -0.0023225559577492484), ('in', -0.0070970853640752495)]	1
405	1	Trump is “angry” that intelligence officials informed Sanders and other members of Congress about some of Russia’s meddling efforts in the 2020 election cycle, Biden said, adding that the administration must do more to secure the integrity of our elections.	[('elections.', 0.026076818719519543), ('more', 0.0050299912201097925), ('the', 0.0031609357513563154), ('some', 0.0018271219244387128), ('Biden', 0.0004946548771838466), ('adding', -0.003976794533187405), ('intelligence', -0.009375764124627628)]	1
406	1	For some years now, conservative and libertarian education policy experts have warned against voucher systems in favor, instead, of tax-credit scholarships and education savings accounts, which are less likely to drag the regulations and mandates of government schools into the private arena.	[('conservative', 0.02144630942370198), ('drag', 0.009654557105875127), ('the', 0.003293733302668389), ('savings', 0.000848378679582954), ('and', -0.00025961616157910925), ('now,', -0.0023112657073757425), ('years', -0.006338674662711057)]	1
407	1	Other protests in 2019 included swimmers from Australia and Britain refusing to join world championship gold medalist Sun Yang on the podium because the Chinese star has been implicated in doping violations.	[('Other', 0.028525157614157734), ('in', 0.009634326931563152), ('world', 0.001404258268964177), ('refusing', -0.00029667842765355724), ('Yang', -0.001561437596733356), ('Sun', -0.008368276332867245)]	1
408	1	Proponents of stricter protections for students argue the DOE’s recent rollback of Obama-era rules aimed at protecting students from predatory for-profit colleges will only lead to even more student defaulting on their loans.	[('will', 0.020801452676996856), ('protections', 0.010530742191990811), ('aimed', 0.0034714644956013673), ('protecting', 3.0706238366432496e-05), ('DOE’s', -0.00227298433726835), ('on', -0.01032888988657959)]	1
409	0	Soccer players who defy Olympic rules by making protest gestures at the 2020 Tokyo Games will be supported by their global union.	[('making', 0.013957146670243191), ('Games', 0.0020505633123708744), ('who', -0.0006880726447780449), ('their', -0.005358389974606775)]	1
410	1	In February, Mexican illegal alien Pablo Hernandez was driving a pick-up truck when he struck a six-year-old boy and a 16-year-old teenage boy as they were crossing the street. 	[('when', 0.022786036393805907), ('were', 0.003569535221495981), ('struck', 6.600621600621359e-05), ('truck', -0.0003859012136322937), ('was', -0.004842195712783975)]	1
411	1	Derrick Morgan, senior vice president for federal and regulatory affairs for oil lobby group American Fuel & Petrochemical Manufacturers (AFRM), bragged about how successful the industry has been in pushing anti-protest legislation,	[('about', 0.02209139763077152), ('has', 0.0021032975759437823), ('Derrick', 0.0009913457317731866), ('Petrochemical', 0.0), ('anti-protest', -0.006860629060668066), ('been', -0.013757381256975398)]	1
412	1	Taken together, these trends leave many young Americans feeling trapped. If they don’t go to college, they have little chance of getting a steady, well-paying job. If they do go to college they’ll be on the hook for tens of thousands of dollars in student loans.  	[('do', 0.02048241342420911), ('little', 0.007488618703927871), ('college', 0.004410073599272978), ('on', 0.003837049443525834), ('dollars', 0.0005522269183688899), ('these', -0.001120848541855145), ('in', -0.0015878270022660567), ('of', -0.00771506197247841)]	1
413	1	But the skeptics have taken on a brasher, bolder tone in recent months. 	[('tone', 0.008447258256044272), ('skeptics', 0.0014866333992960335), ('on', -0.0048949045319581575)]	1
414	1	President Donald Trump said Wednesday that he would become the first U.S. leader to attend the March for Life, one of the nation’s largest anti-abortion protests, in person later this week. The move is likely to be seen as an attempt by the president to appeal to his evangelical base at a time of fierce political turmoil.	[('for', 0.031109291473716084), ('is', 0.010009610615124565), ('that', 0.006164156042555633), ('political', 0.0032495498084291075), ('attempt', 0.0006416686583033082), ('the', -0.00019629343114053956), ('Wednesday', -0.0015090174857821804), ('move', -0.0033979139277693503), ('become', -0.006966431505002928), ('be', -0.010701634729581477)]	1
415	1	Senate Majority Leader Mitch McConnell shredded a House Democratic anti-corruption proposal on Wednesday over a provision that would make going to the polls a national holiday.	[('going', 0.031665495969319425), ('House', 0.007469687101241588), ('a', 0.0), ('Mitch', -0.002403148436808379), ('Leader', -0.010397681373214522)]	1
416	1	Since the migration crisis erupted in 2015, mainly fuelled by the war in Syria, Greece has granted asylum to around 40,000 people, Mitarachi said.	[('to', 0.01888887560573687), ('in', 0.0066745975487936485), ('fuelled', 0.0003431046671837312), ('has', -0.001656527115821742)]	1
417	1	The safe, heavily researched HPV vaccine remains tragically under-used — and anti-vaccine movies and conferences could make it more so if we’re not careful.	[('so', 0.019776271186440673), ('we’re', 0.004868636463567424), ('careful.', 0.00020965940965473663), ('heavily', -0.005029123969722509)]	1
418	1	Samoa on Thursday closed all non-essential public and private services for two days to combat a measles epidemic that has killed more than 60 people, mostly babies and children, in a battle complicated by a vocal anti-vaccination movement.	[('in', 0.023847236082283837), ('to', 0.011788867733393995), ('that', 0.005429376365378633), ('children,', 0.00023825102736388937), ('public', -0.0004895654659805549), ('mostly', -0.0027475325969924047), ('has', -0.013147853612598879)]	1
419	0	In Australia, record high temperatures and drought exacerbated by the climate crisis have ignited blazes that have killed more than two dozen people and destroyed 2,000 homes since September.	[('2,000', 0.021362107224451907), ('since', 0.007252669314058308), ('by', 0.00026023128058550447), ('killed', -0.000933663863428229), ('Australia,', -0.0018718669798041365)]	1
420	1	President Donald Trump touted how his reversal of Obama-era regulations on the fossil fuel industry has led to the United States being the largest producer of oil and natural gas in the world during his State of the Union address on Tuesday at the U.S. Capitol.	[('Obama-era', 0.018882391206225237), ('Trump', 0.008469596771292312), ('Tuesday', 0.0049679179316629105), ('United', 0.003955541421050573), ('largest', 0.0022793482267742427), ('touted', 0.0007969418138024631), ('regulations', -0.007555128135356629), ('has', -0.017607293791141218)]	1
421	1	After winning his 15th major championship, the legendary golfer Tiger Woods got a chance to laugh at all who doubted him.	[('his', 0.013360119932599836), ('the', 0.0033524156027321993), ('Woods', -0.0010197721908800973), ('to', -0.0066245469507640285)]	1
422	1	Schlapp’s apology comes as the U.S. is convulsed by protests after the police killing in Minnesota last month of a black man, George Floyd, by a white police officer, who knelt on his neck for nearly nine minutes. That officer has been charged with second degree murder and three fellow officers have been charged in abetting Floyd’s death.	[('for', 0.017940347633336042), ('after', 0.011448241590000796), ('fellow', 0.00808784429838635), ('George', 0.005631866252418397), ('murder', 0.0010786480132727128), ('Minnesota', 0.00037097961697032055), ('a', 0.0), ('is', -0.0007156969236235434), ('Floyd’s', -0.0026355286567704595), ('officers', -0.008008893860775503)]	1
423	0	As the senators’ letter pointed out this week, government watchdogs have repeatedly called out the PHEAA’s mismanagement of the program over the years.	[('this', 0.02704701413663126), ('the', 0.002397318824306448), ('out', -0.001823477306682386), ('over', -0.00705646411358979)]	1
